prod_id,summary
B00853OGS6,the first thing i bought is the fact that it is not even close to the first time. the only reason i gave it two stars is because the handle is not too big so it is not even worth it. i do not recommend this product.
B008B92GJU,this is a very good product. i was able to use it and have it installed. it is a great product for the price. i would recommend this to anyone.
B008HPAHDU,i got a refund and it worked fine. i was able to get it to work for my new set up and now i can find it. the only thing i can say about this is that it is not as bright as it is and is not a big deal.
B008OSES58,this product is not the best i have ever seen. i do not know how to return it. it is very small and it is not a big deal. the battery is very thin and does not fit the buttons of the lens. i was able to use it on the same order and it works fine. it is a good price and a good product.
B008SA15KI,"i was looking for a bad album to read and this was not a bad choice. it is a very good album, but not for the cost of a friend. i would not recommend this product to anyone."
B008UR3L6A,this book was a good tool. the book was a good book for me. it was a great book. i would not recommend this book if you are looking for something to do with the price.
B008ZCO1QY,"the screen is nice, i am very pleased with the quality of the product. i have a very small camera and i have not had any problems with it. i have not used the product yet, but it is a great product. i would recommend this product to anyone to return."
B0091V9BPE,"i am a fan of the original version of this book. it is not a bad book. it is a lot of fun and i would recommend this book to others who are looking to purchase some of the best books. this one is a nice way to read. the book is a little more difficult to read, but it is not a bad book. i have been using this cd for a couple months now and it is really good and the book is good."
B0096HVJGM,i bought this to use a small tape and it is very flimsy. it is not very bright i would not recommend this product at all.
B0098FKJXQ,"this is a great product. i bought this for my wedding day, and it works well. it is a little on the small side and it is not a big deal for my liking. but it is a good product."
B009E5VHOK,i bought this to be on the third floor. the only thing i could say about this is that the sound is very small. i would have given it 5 stars if it were a bit bigger.
B009GSEHR4,it is a very good tool. i bought this for my tablet and it works great. it is easy to use and the sound is good. it is a nice size for the price i paid. i would buy again.
B009GSWUNM,i was not expecting a good book of this book. i was very disappointed. i was able to find the same material for all of us. the only way to get this book is to read the book and get a different set of different options. i think it is a book that will be useful for the best price.
B009HJUQ7M,i got this set for 4 and they are very small. the only thing i have to say is that the plastic plastic on it is only 8 and it is not very sturdy. i would not recommend this to anyone.
B009JAE7NS,i bought this for my sons wedding because of the price. it is very cute and the colors are very nice but it is not very bright and it is not very good for the cost. i have seen a few of these and it is not worth the money.
B009JBABG4,looks great and it was a great price. i had a nice time and it worked great.
B009T75ZNC,it is a good product. the product is great but i did not notice any of the picture of the screen. i was not happy with it. it is a waste of money
B009VY2QOE,this is a great product. i have a new one in the office and it works just fine. i would recommend this to anyone who is looking for a better price.
B009X78DKU,this is a very good product. it is a little flimsy but it is a good price. i used it for a refund and i am happy with it.
B009XL4J4U,the only reason i gave it 4 stars is because i got one of the smallest size i have ever used. it is not worth the money. i would not recommend it.
B009Y39ORY,it is not a good product. i do not know how to get it to work on the camera but i think it is a good thing i would not recommend this to anyone.
B009YC0W3K,very expensive. i could not get the hook for my camera and the faucet was not too long. tried to use it but i was disappointed with the quality of it. it is a complete waste of money and i would not recommend it.
B00A6SNTW2,"i was not expecting this album to be a good value, but it was a good product. i would recommend this to anyone who is looking for a good set of guitar and a good amount of food."
B00AECQJ68,this product worked fine for me. i was not able to use it because it was so difficult to use it. i will be returning again.
B00AEEEUMQ,i have a new one and it has been very annoying. i have used it twice now and it is so much better. i have also tried to use it on the same phone and it is very hard to get the batteries out. it is a good product if you want to use it to hold it together.
B00AGDLWYE,i got this for my mom and she was not very pleased with the product. it was a little difficult to use and it was a little difficult to get in and out of the box and it was not even close to the first time i used it. i will definitely be ordering this again!
B00AJDBGME,i got this set for my daughters and she loves it. it is a little small and i would not recommend it.
B00AKQ082Y,it was a good thing i was not a fan of the characters. it was not at all what i expected. it is not a big deal but it was nice to have a good time.
B00ALAVS46,"i was a little apprehensive about the quality of the book, but this one was a bad way to kill a few hours. the plot is very hard to understand and it is not as good as the old one. the name of the book is a joke. i think she was looking forward to a few more years of her characters and she was not really excited about this book. it is a good way to book the book and get to know what to do with this book."
B00AMRSNTQ,i got a flat white and it was well made and easy to use. i would recommend this to anyone.
B00ARZIOE2,"it was very disappointing. i was not happy with the purchase. it was a bit of a hassle. it is a nice little place, but not worth the money."
B00AT1GM3E,i was not sure if she was the one who was in this book but i was not expecting a good book. she has a very nice story and looks like she has a good voice. she will not be able to find the same way of a book. it is a great concept and i would highly recommend it.
B00ATJC2GM,do not buy this. it is not user friendly. it is a little pricey
B00B04B0KY,"i was not sure if this was a bad thing, but i do not know how to describe this. it is a very good tool. i would have given this one stars if it was a bit more accurate but it was too much for it to be a pain. we shall be returning."
B00B0VZSEG,i am a fan of this book. i used it once and it was just a bit of a pain. i would not recommend this book. it is a good book. just what i needed to do with a friend.
B00B1FDWDK,the only thing i could find is the small size. i think it is not a big deal if you are a big fan of the original ones it is a good way to get the best deal on your face. the only thing i would like is that it is not for the kids. i would recommend to others.
B00B3FROF0,i was looking for something that was not a one. i was not a fan of the product. it is a good deal for the money
B00B3MSD2G,"this book is a complete disappointment. it is a lot of fun and i like it. i have enjoyed the book and the author books. it is a good book for learning all the features. if you are a fan of books, this is a good book."
B00B84UZKW,"i was not expecting much. it was a good tool for what i needed. it is a little difficult to read, but it was still a good deal."
B00BFSM7YS,i was surprised to find a solid product and a very good value for the price.
B00BJ53ANY,the book was not as good as i expected. the story was not even close to what i expected. i would not recommend this book to anyone. it is not worth the money.
B00BJRCM3Q,"i was able to find her own versions of the original one, and it was a great choice. it is a very interesting story. i would recommend this book to anyone who is looking to the book and get a good book."
B00BLV5GPG,"this is a very good product. it is a good product, but not a real bargain for what it is. it is a very good buy for the price."
B00BP0EZ3M,the only reason i gave it 4 stars is because the book is not as good as the picture. i would not recommend this book to anyone.
B00BQYE9H4,i received the product to be installed and it works fine. the only thing i was disappointed with was the plastic tool. i have not had any problems with it.
B00BWVIN9G,i use this product for my new unit. it is easy to use and works well for the price. it is not a problem with the product.
B00BWYDQ36,"the first time i received this album, i have not experienced any of the characters, i thought it was a great book. the book is great, but the only thing i could see is the lack of detail. i would not recommend this book to anyone."
B00BXVHEZY,i have been using it for over a year and have not had a problem. it is a great product. i would recommend this to anyone who wants to get out of the way of a business.
B00C0ZJ42S,"i have two of these pens for my daughter. i have tried using a different brand of cartridges and it works well. this is a good product for the money it is just a big deal. when you have a problem with a new phone, it is a great product!"
B00C6NHLC4,i was looking for a more expensive book! i was surprised that it was not a real deal. i would not recommend this to anyone.
B00C6OORDO,i received it for a refund and it was not going to break. i got it to work and it works as advertised. i would recommend this product to anyone.
B00C74I9Z0,"i bought this for my wedding day, it was easy to use and i love it!"
B00C9TRH7E,"i am not sure what to expect, but it is not a bad choice."
B00CAE71L0,"i was not able to return it, and i could not find it. i am sure this is not an option for the price. it is not a good way to play with."
B00CHQOT2K,"this book is not for everyone. the music is not as good as the original. the book is a great feature of the original story. this version is a nice addition to the side of the country, but not for any other reason. the book is a very good product, but the only way to get the most interesting of this book is the fact that the book is not as strong as the other two tracks. the only thing i have found to say about this book is the fact that it is a very small version of the same two-year-old. in addition to the fact that the country is good, there is no way to make a good album."
B00CINM2YE,"the first time i tried to use it, i had to return it to the third time. i do not think that it will work for the sound of the phone, and i am sure it would be a better option."
B00CKH0X2G,i am always looking for a good book and this was a gift for me. i guess it is not a bad thing to do. but not for this one.
B00CKW2V3A,"i use this software for a sound-boom, and it does not fit my face. i have used it for multiple months and the phone is very small. i have had to use it twice and it is not very good. it is a good product and it is easy to use and it is easy to use."
B00CLRN47G,"the product is not good for the price, i would not recommend this product to anyone."
B00CMRF9YQ,"i was so excited to see this book. i was not sure if i could get a book headset before. it was a joke. there are so many other games that i never have, but i was not expecting this to be a good thing. i think the picture is too small for a book. i think this is a good book."
B00CRAR2GQ,"very good! it was cute and very sturdy. i got a little more expensive, but it is nice to have a good price."
B00CU8OK88,it is a greatbut it is not as good as i expected. i bought it for my wedding and it is a good product.
B00CWL34IK,i received the phone as a gift for my office and it worked great. the screen was not very long and it was not as good as i expected. it is a waste of money. i would not recommend this product to anyone.
B00CX1LJJK,it is a good product but i would not recommend this product. it is not as good as the old one i have. it is a good tool for a quick fix
B00CY0MAJ8,i bought this for my daughter who is in a rush and it works great. it is a great price for a light bulb.
B00CYNN4ZO,i had a one of these phones in this thing and it is very hard to use. i did not use it on my computer cord but it worked great. i was able to use it as a gift for my family and i could not be happier with it. i am very happy with this product!
B00D1PGELA,"it is a bit of a pain to use, but it works fine. i would recommend this product to anyone."
B00DD5UYOG,"i used this product for my tv and it was easy to use and easy to use. the only drawback is that it is not very bright, but it works great and i recommend this product to anyone who is looking to get it together."
B00DD6ICX0,this is a great product. i have purchased the same day and it is very easy to use. i have used it twice now and it is great. i would recommend to others.
B00DGXS9VK,i love this program. the only thing that is a disappointment is that it is small and extremely difficult to get in the way of your car. i would recommend this to anyone who is looking to get a good book.
B00DKHJZUQ,i had to return it and the book was not as good as the original one. i will not be buying another one.
B00DYJ0ZNG,"i ordered this for the first time and it is a great product. it is a very convenient product, but it is a little pricey for the quality and it is not too big for a low price."
B00DZG2XK6,this is a great product. i have not used it yet but i do not know what to say. it is a good product and just what i needed.
B00E6AQ96Y,i bought this for my wedding day and it worked great. it is very easy to use and it is a great product. i have a small and light and the metal was great. i would recommend this to anyone who wants a nice clean and light and easy to use.
B00ECN4PWA,i was not expecting a good book. i was a little disappointed in this book. the author was not for me. i think that was the first one i have ever seen. i am not sure if i would be a fan of this book.
B00ECUG9TA,"i was not expecting a good book, but i wanted to like this book. it was a little tricky to find, but the book was not as pictured as the other. the book is not as good as others. this was a good book for the price. i think this book will not be the same as the original version of the vanji. the book is a little difficult to see in the picture. it is a good book, but i would not recommend it."
B00EDYL3FU,"i was not able to use the book. it was so easy to see, but it is a small book, but not worth the money."
B00EE7213E,the product is not as good as the picture i received. i got a refund and had to replace the battery for a month.
B00EHSUFD8,"i was pleasantly surprised. i had read reviews and found this page for a few days. the only time i used to use it. i am sure the other reviewers would be better off using a higher end. the first one is not as accurate as the ones in the picture, but it is a great book."
B00FCNKTPQ,"i was very excited to see some of the characters i had just received. the book was not a huge deal for me. the only thing i could say about this was the lack of information. i did not read all the descriptions on the book, but i was impressed with the story. the book was great. it was a fun and easy to read, and i would recommend this book to anyone who wants to learn to check it out. it is not a bad choice. just not the best book, but this is a great book."
B00FUUDP1G,"i had a lot of fun. the story was not very good. the door is not very bright and it did not fit the bill. the cage is a joke. i would not recommend this to anyone, it is not too bad. you will not be disappointed."
B00FVXZ57Y,"i have been using this product for the past five years, and have had no problems with this. the story is very good and the results are great."
B00GATDL7O,"this is a very good album of the best cd, but not a fan of the songs. the songs are also very good. it has a pretty good sound for the price, but it is not a good thing, i think it is worth the money."
B00GB0VRZA,i was not thrilled with the book at all. it was a disappointment and the book is the same. i would not recommend this book.
B00GG02SIA,"i was not expecting to see a good book that was not as good as i thought it would be. but i was not impressed with the quality of the repetitive. it is a bit of a hassle to find out there, but that is why i thought it was a good value. i would have given it 5 stars if it were a little bigger."
B00GZAZX2O,i was really looking forward to this book and it was a goodwill not be the first one to get
B00HEWJO7W,i bought this to use for her birthday. it was a good purchase and i would recommend it to anyone who is in need of a quick and easy one.
B00HHH8B0U,it is not a good book. it does not even have any features. there are no lines for the same material and it is not a huge deal to me. i think it will help you get the same thing that i had.
B00IDNLAOQ,this is a great product. i was able to get a good introduction to the original version of the 70s version. the other one is not very good. the only thing i can say about the book is that the main character of the original cast is not a good thing. i was impressed with the quality of the album.
B00IGK7IRO,this is a great book. the book is great for the money and the fact that the book is a joke. it is a great book. i would recommend this book to anyone who is looking for a great book.
B00IGSMYHK,"it is a good book, i would recommend this book to anyone who wants to have a great time. i will be using this for a while."
B00IJKERAM,"this is a very poor product. the only thing i can say about this book is that this is a good deal. if you are looking for a real pro, you will enjoy this book. it is a good one. will be returning."
B00IY5RM04,it was a little hard to read. i had to return it.
B00JPJQR4U,i would not have liked to have a better time. i would not recommend this book. it is not a real album.
B00JW1R79U,i had a hard time finding a book that i wanted to use. it was a great book. the book is great for the price. not a bad choice.
B00JX4TOLA,i was not happy with this. it was a complete waste of money. i think it was a good deal. will be buying again.
B00K7Q8I1A,i had to return it and then the other side of the book is not worth the money. not worth the money.
B00KFAT4QG,"it is a real disappointment. i cannot imagine how much it was worth the price, but it is not worth it. it is not for the price, but it is not worth the money."
B00LADYBSS,not as good as expected but i found the album to be a good value. no complaints.
B00LAGPOO0,i bought this for the first time. the only thing i can say about this book is that the external has a very limited amount of space. it is not for everyone. the only thing i could say is that the book is not as good as the original version. i am very disappointed in this one. i would not recommend this book.
B00M179WOU,"i was so excited to see this book in my book. it was very interesting, but could not hear the person at all. very disappointing. the book was a bit of a pain to me to say for the price and the size of the book that i had to do. i will be returning/back to the other bars to succeed."
B00MF8BJQE,"i was really excited to try this when she is in the area, and it was a good choice. the only thing that i could say, is that the story is very short. it is a very good plot and the story is a bit of a mystery to me. i cannot wait to see if it is the best for an artist, but this album is a must have for the price. i would recommend this book and be sure to buy another."
B00MN06YDM,"this is a good value. it is a good product. she has a real character, loves it. i will be able to see more of the other ones."
B00MWDIUKU,the headset is very small and the metal is not very bright. it does not fit my needs. i think it is a good deal.
B00NQ7K284,i like this book. the only thing i would like to try is the black. the only good thing is that it is not as good as i expected. it is a great book and i would recommend this book to anyone who wants to hang out with a local book. thanks for the help.
