prod_id,summary
B0002VQDVM,"i have used the same battery as a mixer for my old one. i have used the phone for about 2 weeks before i have to use the phone to make it work. it is a very good design, but the device is very flimsy. i have to use a new phone to use the device. i do not know how to use this software, but the first one i tried to clean up all of the colors. i have ordered these to a different display and have not had any problems with it. i would recommend this product to anyone who wants a good product."
B0009MYS9S,i have used this to use a software that was not working. i was very disappointed. the only reason i gave it 4 stars is because it is not a very heavy duty design. the metal is not very bright. the reason i bought the two stars is that it is a bit flimsy. i have to return it and get a better product. i would not recommend this to anyone.
B000BI4KKM,i do not know what happened to this program. i bought it for my daughter who has a problem with the camera. it is a bit too small for the metal. i would recommend this to anyone who is looking for a very good price. very happy with the purchase. it is a great product.
B000CQFMEQ,"i bought this for my gps phone and it is very easy to use. the only thing i have to say is that the software is not very sturdy and does not fit the battery in the world. i wish the program was low and the sound was good. i find that it is a small, but a bit pricey for the product. i would recommend this to anyone who is looking for something more expensive to watch on this side of the house."
B000FYU4SO,"i have been using this software for about 5 months now and the first time i used it is not very easy. the sound is great, it is very hard to use, but it is still good. it is very easy to use and have a good tool. the only thing i have to say is that the battery is not a tit keyboard. it is not as easy as i would have hoped. it is a very good tool to use as a phone for a gps unit. i would definitely recommend this product if you are looking for a replacement"
B000HDZA28,"worked well for the first time and i was not able to find the proper piece of paper. i received a replacement and was able to return the phone. i was told it was a screw, but it does not fit in the picture. i would recommend this product to anyone."
B000I8FWMK,this is not a huge deal for a big box but it is still not a big deal. i really like it and i am happy with it.
B000JCDUFG,i was looking for a new one. i found that the first one was not on the website and i was not able to get it to work with my gps. i do not know if it is the fact that i would have to use it. but these are a great product.
B000M92GLK,"i cannot say anything about the quality of this product. i have not used the magnetic handles, but they are still working on the computer. i do not know how to use it and i have not read the other reviews. it is a very good tool for the price. i have been using this for over a year now and will continue to use it again."
B000Q5J2M6,"i am a fan of the original version of this set. it was a lot of fun. i was very disappointed with this unit. it was not as good as i thought it would be. the only thing i would say is that the problem is that the metal is not a piece of metal holder. the description is not user friendly, but the handle is very small and the metal rod is useless. i have not used it yet, but it was a good purchase."
B000SRGF2W,"i was looking for a new book for my dad, and I am not sure how to describe this book. it is a great product. the book is very well written and is a must have. the book is very good and the author is a good tool. if you are looking for something to do, you will love it. it is a great book for children who love to learn to learn a lot of patience and learn how to learn how to get a good book. this is a great gift for a friend or a friend."
B000WCWUWM,"i am a fan of this book. it is a bit of a pain to see, but the story is a little bit more complex than the original, but it is not as bright as some of the other reviewers. the book is a great album. i really like the fact that they have a lot of features for the price range. it is a little difficult to read, but it is a must have for me. i am sure it is a great book."
B0018969BG,"i have been using this for a couple weeks now and it was so much better. this is a very good product. i have been using it for a few months and it is just what i needed. i would recommend this product to anyone who wants to see my new pc. if you are going to get a new set, this is a good deal."
B001AS6J24,the only thing i wish i could have had a little more time for the phone. i have a few other pieces that are not included in the price and i am happy with the quality of it. i would recommend this to anyone who is looking for a replacement and a nice product.
B001B4AAJ0,"the product is not as strong as i expected. i have a large camera, and it is a big deal. i would have given this 5 stars if it had a good price for the product. however, it is a complete waste of money and it is a bit of a hassle. i had to return it to amazon. i did not expect a phone at all. i would have given it five stars if it was a better product."
B001BB242E,"i bought this for my daughter. it was a gift for my daughter and was able to use the camera on the computer. it will not fit into a computer. the only thing i would give it a negative rating would be to have the same problem, but after a few weeks of use, it has been a great product for the price. i would recommend this to anyone who wants to know how to use it."
B001E42QBW,"this product works fine, but i have had it for almost 2 months now. the software is very flimsy, i have to use them on files for a month and had no power cord. i have purchased the software for the same company, which is a good feature, but the software is not very good at all. the software is not very useful for the price. the only reason i got this one is because it is a very very thin piece of junk."
B001HVWUDG,"i purchased this product for my first time, it is a very difficult to use. the only reason i am not giving this one star is because the metal is a little flimsy. i would not recommend the clamp to anyone who is looking for an alternative to the original version. if you have a problem with a new computer, it is not a bad seat."
B001MYLTDA,"this device is very easy to use. i have only used the phone and it will not work on my computer. i have not used it yet. it is not as easy as it is user, but the software is great. i have a new phone that is a little difficult to find. but i do not know why anyone would want it to work. there are no power cord. i would not recommend this phone to any of those who do not want to use it."
B001N48GGC,i have a few of these and this is not worth the money. i do not recommend this product.
B001NZ0WP4,"i love this cd. it is not the best. it is not a bad cd but i think it is better than the original version of the other ones. if you are looking for a new cd, you will love it. it is not for you but worth it."
B001PKTRVM,"i have been using the new phone for about a year now, and i have had a very good experience. i have returned the phone for about a week and the company was very helpful. i have been using the phone for a few months now and i have not had any problems with the phone. the only thing i wish i had was a little more time to get the phone back and forth from the computer. the phone is extremely nice and works well for me."
B002DRMPMY,this is a good set of software for my young children. this is a very low price and works well. i have a small compact mirror at the same time and it works fine. i would recommend this to anyone.
B002EOTJFM,i have a lot of pens and this is not good at all. i have a new battery for over a year and it works fine. it is not worth it.
B002JWJYX6,"i had to replace it with a new one, but it was a little complicated and i have to use it for the first time i used it. it is a good tool for the price."
B002QIQ76K,"i ordered this for my son to have a few phone on the phone and it was not as easy as i thought it would. i received this phone and it was a bit tricky to hold. it is a lot of stars, but it is a very good product! it is a small price for the quality of the device. i was able to get a new one and it has been great for a while. it is a good value for the money!"
B002S5R4IG,"i was not expecting this product to be a good replacement, but it worked great for me. i was able to use this product for my old media time and it was a good product."
B002V6A2PE,i used this to use it for a refund and it is still a good deal. i have only used 2 of them and the only thing i can say is that it is not a very good tool to use as a new phone. it does not have a lot of bluetooth. it is very easy to use and have a good sound quality.
B002WC7RKA,i used this product for my new pens and it was much less painful. i was very pleased with the quality of the product. it could have been a little easier to use and it was not worth the time. i will not be buying this again.
B0036FTZZW,"after reading the reviews, i was very disappointed. i was not expecting this set to be a pain in the world. it was a complete waste of money and i was very disappointed in the quality of this book. the other two of the characters were great."
B003GLIDRM,i purchased this product for my computer. it was easy to use and it was easy to use. i am very pleased with my purchase.
B003SU4ZRS,i bought this for my printer to use and it is very easy to use. the quality is good and the screen is very comfortable. i will be returning in the future.
B003UO175U,these are a great product. i bought these for my tablet and it worked fine. i would recommend this product to anyone who is looking for a replacement set of paper and a small phone to use. i would recommend these to anyone who is looking for a replacement type of quality device.
B003VDC4PW,i bought these to replace the battery and the battery was not as strong as i expected. the carbonation problem was a little flimsy. the sink is not very sturdy and the ceiling did not fit well. i would buy again if you need a replacement bulb to replace the unit. i would not recommend this product.
B003ZHPWKS,"i was looking for a replacement for my iphone. it was very difficult to find the same product between the same company and the other two. they do not fit in the holder, and it was not even close to me. i was hoping for a better price, but it is not worth it."
B00403MNZ8,i was very disappointed with this book. i had to go to the top of the hall to get a refund.
B0043RTJEY,i received this product because i had bought it on amazon and the other one was in the same day. i was told it would be a bit more than a few days. the only reason i am giving it 4 stars is because it is a piece of junk. it is also not worth the hassle. the only thing i could think of is that it is junk. i will not buy this again.
B0044MPB2W,"this is a great product, but they are not very comfortable. i received a full refund and it was a good price. i would recommend this to anyone who wants a good one."
B0046SHQG8,"i have had this in a few weeks. the second time i used it to get the original light bulb, it was not even close to the first set of the bulb. they are not as strong as i expected. the only thing i have to say about this, is that it does not hold the stainless steel, the cartridge was not very sturdy. i would not recommend this to anyone who has a bad time."
B004BB1OLI,"i bought this for my laptop and the other one was broken and it was not very easy to use. the only downside is that it is not a big deal for the price, it is not a big deal but it works great for the price. i will be using it for the next month."
B004CMIB8K,"i bought this to replace my old one, it is very thin and the metal is too big. i would recommend to anyone who wants a quick, easy, and easy to use for a replacement. it is a good product and is a good price."
B004EYI02S,i have been using this product for a few months now and it is great. i would recommend it to anyone who loves a good price. it is a great product for the money.
B004JZFWVO,"i have been using this product for about a year now, and it is nice and clean. the only reason i am giving it 5 stars is because the tape has a little bit more of a leg to the seat. i am sure that it will last longer than i would have expected. i would recommend this product to anyone."
B004LZ576M,this book is a lot cheaper than i expected. i was looking for a compact cd to go with this cd. it is a shame that the book is not as good as the original version. i am sure it is a great buy.
B004MGCD0I,the handle was very difficult to use and i was not able to get it to work. i was able to get it to work on my computer and it works great. i will not be buying this again.
B004RE2HS8,i was looking for a new one and i was not disappointed. it works as advertised and i was happy with it
B004U349UA,"i had to return the book because i was not excited about the book, but the book was not as bad as i expected. the first thing i noticed was a few of the characters were not up to date and the story of the book is not good. i would not recommend this book. this is a great book, but not for the money."
B004VMZZ3K,"i purchased this product for my daughter. it was a gift for my boyfriend. the only problem is that it is a little difficult to get the battery to be on the shelf without any problems. if you do not have a very high sugar, you will love this product. the only thing i really like is the fact that the keyboard is not available for the time i used it."
B004Z29550,the product was not as sturdy as i expected. i would not recommend this product. i would have given this 5 star rating if i could.
B004ZGH062,"i got the phone to use for the phone and i am very happy with it. the phone is very nice, easy to use and works great!"
B004ZS9ZP4,"i used this product for my wedding, so it is very easy to use. it is a great product for the price. it is a very good price. i would recommend this product to anyone!"
B0052CHOS2,"i bought this product for my wedding and had a problem with the phone. the cord was not a problem, but it was well worth the money. it was a good price for the product and the price. this is a great product for the price. i would recommend this product to anyone."
B0053O8L6I,i was not sure what to expect. it was just a little too big for me. i ordered a small amount of keys and it did not fit. it is a good price for the price. i would recommend it to anyone who is looking for a quick and light bulb.
B005441EVQ,i have a new phone. i have been using it for a few days and it works great. i have a new phone for a few months and have not been able to use it yet. the only reason i did not give it 5 stars is because the volume is not that good. it is still a greatbut the software is not user friendly. the only thing i did not like is that it is very low quality and works well.
B0055AWHP6,"i have a lot of fun and this book is a lot of fun, and i would recommend to anyone who wants to learn the language to get the best on the book. it is a very good value for the money. the only thing i can say about this is that they do not have a lot of space in the book. there is no way to take the steps to the author, it is not the same as the other one in the past."
B0055BKII8,"i got this to use on a computer and it works great. i tried it for a wedding and it is very well designed and easy to use. it is a good product, but it does not work for me."
B0055S1U1K,i really like it. it is a little on the small side and it is a little flimsy but it is not too big that i would not buy it. i do not recommend this product.
B0057BE9PO,"this is a great device, easy to use and easy to use. i have a couple of phones and it works great. i have been using it for years and have not had any problems with it. i have not had any problems with the keyboard."
B005AMUTJ0,i really like the way the book is. it is not as clear as the other ones. it is not a bad thing but i think it is a great buy.
B005BA72GO,i bought this to replace the cartridge for my new one. it is been a long time ago and i am very pleased with the quality of this product. i cannot say enough about the quality of this product. i cannot say enough about how well it is designed to be in a system and is able to use the same product for my new phone.
B005BINK4Y,"i have purchased this phone for the past 5 years and i have had a great product. i have used the software for 3-4 months and have been very happy with the quality. i recommend this product to anyone who needs a quick, inexpensive product."
B005CERU0M,"this is a good product, but i am not sure if i would like it for a long time. it is a very good product. i have not seen any of the other areas that were available at all. i have not used it yet but i think it will be worth the money."
B005DFEFDU,i was surprised to see it came off and it was not a good thing. i would have given it 5 stars but the other two were not as good as the one pictured. maybe i will not be purchasing this again.
B005DMMEMM,"i was not expecting this to be a good book. the book was not as easy as i would have hoped. it was a great story. it is a great book, and i have found that the author was great. this is a good book, but it is not worth the price."
B005I0GXO4,"the book is not as well written, but if you are a fan of the original book, this is not the best book. the book is well written and is very nice. the book is very bright and the voice is perfect. the book is very difficult to read and the author is a little scaring on the guitar, but i do not think it is worth the cost of the price. i would not recommend this book to anyone."
B005ISQ7JM,"i was very disappointed with this book. i had to return it because it is a bit of a pain. i am sure if i find myself on the market for a better program, this would be a great choice."
B005JPT86S,the best part of the book is the ability to get a good view of the history of the old characters. the only thing i can not say about this is that the book is not a problem. i would buy this again.
B005JYUWVY,"i was really excited to give it a try. it was a great set of dvd-player. it is a good product, but not for the money. i am not sure if it is a good thing but it is for sure. it is a good book, but not for the money."
B005KDF8QI,"i do not know how to get this one, i had to use it and it looks like it will not last long. i am using it for a few weeks and it is still working."
B005OGO2AY,i have had to write this review for a while. i love it! the only thing i have to say is that the position is not very bright. i am not sure if it is an issue but it is not as good as the other one. i would recommend this product to a friend.
B005PUZO92,i have been using this for a few years now and have not had any problems with them. i have tried many different colors and have not had any problems with it. the only thing i have not noticed is that it is a bit small and it is not easy to get a good seat.
B005PVXIVM,"these are not very bright. i have a little one and the other one was not working properly, so they are not as strong as i expected, i would not recommend this product to anyone. this is not a good thing i would not recommend this product."
B005QTTDZ8,"i received this product and it was not working properly when i received it, i was not able to use it and it works great and i am sure it will work as a replacement for the money"
B005T54NYK,"i was not a big fan of this book, but it was not the case. i would not recommend this to anyone who knows what it is. it was not a big deal for me. i would not recommend this book."
B005W5W006,it came with a very flimsy plastic pack. i was not able to see the battery in the mirror and it was not very good. i did not notice any difference on the product. i would not recommend this to anyone.
B005Y2MYNK,i am just a bit of a fan. i was excited to see this one. it is a good addition to the end of the world. it is a good book.
B005Z18ULK,i have a very small problem with the camera. i have not used the sticky floor yet. i have no problem with the time that i have to use the software to help you. the sound is good but the only thing is that it is not very sturdy and the plastic is not very useful. i have not used the program yet but i shall be buying another one.
B005Z19G7M,"i had a few of these pens that were not up to date. i had to use a few different ones to do the same thing. i was extremely disappointed with the product and would recommend this product to anyone. the only issue is that the sound quality is not good and the sound was not very good. if you want to keep your fingers in place, you will be disappointed."
B0061N848A,"i was very excited to see the story. it was a wonderful album. the book was a great value, but i was really disappointed with this book. it is not a bad book, but it does not have the same quality of the characters. it is a bit of a hassle to get a table but you will be able to return it."
B0063672C4,i was wrong. the only reason i gave it 2 stars is because the description was not as comprehensive as it was described. but i do not think it is worth the money. it was a waste of money.
B0064GYRFI,"i bought this for my christmas party. it is a little slow to get a hold of the size of the keyboard. it is also a little difficult to use, but it is not a problem. it is a good choice for a quick work and a good price."
B006DI8FIW,it is very flimsy. i was not able to use it. it is a small plastic plastic. it is not very sturdy and the buttons are very thin. i would not recommend this product.
B006G3C8SW,i used it to make a great product and it was a great purchase. it is a gift for my husband and a very big white. she loves to go and she loves the same product.
B006PNKS2Q,i really like this book. it was a great price. some of the other books were just fine. i would have given it 5 stars if it was a better product
B006S4X7DE,"this book is a great book for those who have forgotten about the games. the book is not the best but it is still a good product. i am a fan of the original one on the other side of the book, and this book is very good."
B006SKO09S,i have not used it yet but i have not had any problems with it. i have been using it for about 6 months and it works great!
B006UCVJKM,"i agree with the other reviews, this is a great book. what i did not like was the fact that it is a bit of a hassle for those who want to have a good time. i would recommend this book to anyone who is looking for something to do with the exercises and people who are looking to learn how to use it."
B006VYMHT6,my son was looking for a new one and i have not had any problems with this. it is very flimsy and it is not even the same size as it is supposed to. i think it is a waste of money.
B006W0PPAM,i received it for my new phone and it works well. it is still working fine but i do not recommend it.
B006YXIF8G,i like the way it is made and it is not very bright. the only thing i have to say about this is the light. the metal is not great and it is not very bright. i would say it is a good product.
B006ZDPPBA,the main character is a little bit of a hassle to read. the only thing i have noticed is that the book is not very bright. i would not recommend this book.
B00761OU0C,not what i was expecting but the story was a lot better than i expected. i was able to get a good view of the book and the story is not as good as it is supposed to. if i had known it would be a very good ending.
B007CE0ZA2,"i can honestly say that this is a very good tool, but i can only use it to get the best quality for the money. if you are looking for something for the price, this is not the case."
B007FWO19W,"this book is not as good as some of the other reviewers. the book is not as well written as i would like, but it is not what it is supposed to. the book is not as good as the original one and the story key is not as good as the old one. i would not recommend this book to anyone who is looking for a good book. the book is a big disappointment. i would not recommend this book to anyone who is looking for a good book."
B007HIMU3S,i bought this for my daughter and she loved it. it is a good setup and it is nice to have a good time.
B007Q2ZKD2,"i do not think i will be able to find this cd. i would not recommend this book. it is not for a night or a family of 5-7. it is a very good book, but the book is not worth the money. it is a very good product for a high-end program. do not buy this."
B007RRPPH2,"i had to return them and have them do a good job. i have used the phone and had it to work on the other side of the house. the only thing i could say about it is that the dvd is not very bright and it is not a big deal. if you want to get a reliable look, do not waste your money."
B007SJHHH0,i bought this for my grandmother who has a driver. it was a mess. the battery was not even close to the first time. it is a greatbut it is a bit of a hassle and the thing is too hard to use. i wish i would have known better.
B007X90DNK,it is a little difficult to get the correct size and it does not work at all. i had to buy another one to replace it. i am very happy with it.
B007Y117IC,this is the only one that i could find out there. i have the same issue as it is a small piece of junk and i have had it in the past. it is a decent product but the product is not very good and it is not a good deal for the price.
B007Y73CGQ,this is a very cute little product. i have not used it yet but it is still very good for my daughters. i would recommend this to anyone.
B008327Z6O,i have a short time finding this book. i am sure the book will be more comprehensive. it is a good program for the money. i would recommend buying this product to anyone who wants a good book. i have been using this for years and have been using it for about a year now.
